Datum,Titel,Text,Plattform,Hashtags,Status,CTA
01.05.2025,Mehr als Männlichkeit. Dein Stil beginnt jetzt.,"Bist du bereit für die neue Definition von Männerpflege? Von Berlin aus startet eine Bewegung für Stil, Qualität und echte Resultate. HAIROTICMEN ist nicht nur ein Produkt. Es ist eine Haltung.","Instagram Reels, TikTok",#Hairoticmen #PflegeFürMänner #BerlinStyle #MadeInGermany #Männerpflege2025,Bereit,Jetzt entdecken → hairoticmen.de/mission
02.05.2025,Registriere dich & erhalte Punkte + ein kostenloses Produkt!,"Du willst mehr aus deiner Bartpflege rausholen? Werde Teil unseres Loyalty-Programms: 50 Punkte Willkommensbonus, Rabatte, Geschenke und kostenloser Versand.","Instagram, Facebook",#Bartpflege #Herrenkosmetik #LoyaltySystem #Hairoticmen #GratisProdukt,Bereit,Jetzt registrieren: hairoticmen.de/mission
03.05.2025,Salonpartner gesucht – Wir bringen das Premiumprodukt zu dir!,"Barbers & Salons aufgepasst: Erhalte ein kostenloses Standdisplay, Gratis-Proben & Provision bei jeder Empfehlung. Werde offizieller Partner!","Instagram, Facebook",#Salonpartner #BarberBerlin #Männerpflege #HairoticmenPartner,Bereit,Jetzt anmelden: hairoticmen.de/mission
04.05.2025,Beard Oil auf einem neuen Level.,"Arganöl, Jojoba & Vitamin E für mehr Glanz, Pflege und gesunden Bart. Dermatologisch getestet. Jetzt testen und den Unterschied spüren.","Instagram, Facebook",#BeardOil #NatürlichePflege #Männerkosmetik #Bartliebe,Bereit,Gratisprobe sichern: hairoticmen.de/mission
05.05.2025,Verdiene Geld mit deinem Netzwerk!,"Werde Teil des Affiliate Programms: 10% Provision, personalisierter Link, Live-Tracking & Bonuspunkte. Kein Risiko – nur Vorteile.","Instagram, Facebook, LinkedIn",#AffiliateGermany #Nebenjob #OnlineMarketing #Hairoticmen,Bereit,Hier registrieren: hairoticmen.de/mission
06.05.2025,Wir garantieren Qualität.,"ISO 22716 zertifiziert, dermatologisch geprüft, keine Parabene oder Sulfate. HAIROTICMEN steht für Premium-Qualität mit Verantwortung.",Instagram,#Geprüft #ISOQualität #DeutscheKosmetik #HairoticmenZertifiziert,Bereit,Zertifikate ansehen: hairoticmen.de/mission
07.05.2025,Jetzt Vertriebspartner werden!,"Sichere dir Zugang zu Einkaufspreisen, Support, Werbematerial & Online-Dashboard. Unsere Produkte verkaufen sich fast von selbst.","LinkedIn, Facebook, Instagram",#Vertriebspartner #Handel #KosmetikDeutschland #HairoticmenBusiness,Bereit,Jetzt bewerben: hairoticmen.de/mission
08.05.2025,48h Deal: Gratis Shaving Gel sichern!,Nur für 48h: Registriere dich + erfülle 3 Aufgaben und erhalte unser Shaving Gel 100ml kostenlos zum Launch. Kostenloser Versand!,Instagram Story + Feed,#Aktion #ShavingGelGratis #LaunchGift #Hairoticmen,Bereit,Jetzt mitmachen: hairoticmen.de/mission
09.05.2025,Mission 1: Kommentiere & Gewinne!,Kommentiere mit 'Ich bin dabei' & erhalte 10 Punkte. Teilnahme an 3 Tagen = VIP-Level! Starte deine Mission jetzt.,"Instagram, TikTok",#LoyaltyMission #HairoticmenChallenge #PunkteSammeln,Bereit,Mission starten: hairoticmen.de/mission
10.05.2025,Welches Level bist du?,"Jedes Level bringt Vorteile: Starter, Männerprofi, VIP & HERO. Einfach interagieren & profitieren – jetzt Level checken!",Instagram Carousel,#LoyaltySystem #LevelUp #HairoticmenHero,Bereit,Level checken: hairoticmen.de/mission
11.05.2025,Nicht einfach Shoppen. Smart Shoppen.,"Deine Website ist dein Dashboard: Bestellungen verfolgen, Punkte sammeln, exklusive Angebote nutzen. Shopping 2.0 beginnt hier.",Instagram Feed,#SmartShop #Männerpflege #DashboardErlebnis,Bereit,Profil anlegen: hairoticmen.de/mission
12.05.2025,Deine Reise beginnt hier,Einloggen. Entdecken. Bestellen. Belohnt werden. Deine Journey beginnt hier. Jetzt Konto erstellen & loslegen.,Instagram Reels,#ShopJourney #Männerkosmetik #HairoticmenReel,Bereit,Jetzt Konto erstellen: hairoticmen.de/mission
